{
  "schemaVersion": 1,
  "phaseId": "5.22",
  "status": "in-progress",
  "activeStage": null,
  "completedStages": [
    "P5.22-00"
  ],
  "blocked": false,
  "blockerReason": null,
  "baseCommit": "c5e6c654fb60bf68d696046ae0c9e06829b79da7",
  "lastVerifiedCommit": "8d38f6214bbd4afc675b1ad913922276dd307e46",
  "currentBranch": "feat/p522-source-bassline-practice",
  "requiredGates": {
    "P5.22-00": [
      "p522-00-phase-docs-validation",
      "p522-00-phase-validator-tests",
      "p522-00-capture-vault-baseline",
      "p522-00-bass-practice-baseline",
      "p522-00-security-import-baseline",
      "p522-00-lint-typecheck",
      "p522-00-rust",
      "p522-00-diff-privacy-hygiene"
    ]
  },
  "gateResults": {
    "p522-00-phase-docs-validation": "pass",
    "p522-00-phase-validator-tests": "pass",
    "p522-00-capture-vault-baseline": "pass",
    "p522-00-bass-practice-baseline": "pass",
    "p522-00-security-import-baseline": "pass",
    "p522-00-lint-typecheck": "pass",
    "p522-00-rust": "pass",
    "p522-00-diff-privacy-hygiene": "pass"
  },
  "nextAction": "Wait for explicit authorization before starting P5.22-01. P5.22-01 is queued but NOT STARTED.",
  "updatedAt": "2026-08-21T13:20:00+09:00"
}
