{
  "schemaVersion": 1,
  "phaseId": "11.0",
  "status": "in-progress",
  "activeStage": "P11.0-03",
  "completedStages": [
    "P11.0-00",
    "P11.0-01",
    "P11.0-02"
  ],
  "blocked": false,
  "blockerReason": null,
  "baseCommit": "73507e8726b6090732ba796f87e7287ba70be4a7",
  "lastVerifiedCommit": "5d7089c2a92c2b0ae962947a51f3aa0d3aef35ea",
  "currentBranch": "feat/phase11-voicing-loop-v4",
  "requiredGates": {
    "P11.0-00": [
      "p11-00-audit",
      "p11-00-phase-docs",
      "p11-00-hook"
    ],
    "P11.0-01": [
      "p11-01-focused",
      "p11-01-feature",
      "p11-01-ui",
      "p11-01-screens",
      "p11-01-phase-docs"
    ],
    "P11.0-02": [
      "p11-02-focused",
      "p11-02-fast",
      "p11-02-phase-docs"
    ]
  },
  "gateResults": {
    "p11-00-audit": "pass",
    "p11-00-phase-docs": "pass",
    "p11-00-hook": "pass",
    "p11-01-focused": "pass",
    "p11-01-feature": "pass",
    "p11-01-ui": "pass",
    "p11-01-screens": "pass",
    "p11-01-phase-docs": "pass",
    "p11-02-focused": "pass",
    "p11-02-fast": "pass",
    "p11-02-phase-docs": "pass"
  },
  "nextAction": "Implement P11.0-03 partial source fallback; continue in order through P11.0-06.",
  "updatedAt": "2026-10-01"
}
