{
  "schemaVersion": 1,
  "phaseId": "9.3",
  "status": "completed",
  "activeStage": null,
  "completedStages": [
    "P9.3-00"
  ],
  "blocked": false,
  "blockerReason": null,
  "baseCommit": "4d25508e9d353515dbac8b1d30cb5e153bf08810",
  "lastVerifiedCommit": "175807c0207bc761c0571f563824268ea9a155f2",
  "currentBranch": "research/phase9-core-v2",
  "requiredGates": {
    "P9.3-00": [
      "research-tests",
      "matched-dev",
      "frozen-validation",
      "candidate-funnel",
      "source-restoration",
      "typecheck",
      "phase-docs",
      "ai-handoff",
      "privacy-security",
      "production-diff-zero",
      "fresh-full"
    ]
  },
  "gateResults": {
    "research-tests": "pass",
    "matched-dev": "pass",
    "frozen-validation": "pass",
    "candidate-funnel": "pass",
    "source-restoration": "pass",
    "typecheck": "pass",
    "phase-docs": "pass",
    "ai-handoff": "pass",
    "privacy-security": "pass",
    "production-diff-zero": "pass",
    "fresh-full": "pass"
  },
  "nextAction": "STOP after P9.3 research; candidate NO-GO. Do not start P9.4 without separate assignment.",
  "updatedAt": "2026-09-29"
}
