{
  "schemaVersion": 1,
  "phaseId": "5.39",
  "status": "blocked",
  "activeStage": "P5.39-03",
  "completedStages": ["P5.39-00", "P5.39-01", "P5.39-02"],
  "blocked": true,
  "blockerReason": "PROMOTION = FAIL: Gate G cannot be satisfied because no tracked privacy-safe ground-truth binding independently identifies the private Family-C target windows; Gate H also retains one unresolved changed identity.",
  "baseCommit": "0eedf268a6231967409d2aa08e51ebed590501c2",
  "lastVerifiedCommit": "122c7456c2692d2fdd318d88738022b6e0f8256d",
  "currentBranch": "feat/p539-family-c-representability",
  "requiredGates": {
    "P5.39-00": [
      "collision-check",
      "p538-closed-in-ancestry",
      "p537-closed-in-ancestry",
      "vocabulary-seams-audited",
      "generated-baselines-frozen",
      "promotion-gates-frozen",
      "family-a-invariants-frozen",
      "family-b-invariants-frozen",
      "focused-stage00-tests",
      "official-clean-suite",
      "validate:phase-docs",
      "validate:ai-handoff",
      "production-diff-zero",
      "git-diff-check-clean",
      "privacy-clean"
    ],
    "P5.39-01": [
      "production-diff-zero-stage01",
      "schema-fileversion-diff-zero-stage01",
      "target-a-12-roots-stage01",
      "target-b-12-roots-stage01",
      "metamorphic-four-per-root-stage01",
      "order-register-octave-doubling-invariant-stage01",
      "bass-separate-stage01",
      "omissions-explicit-stage01",
      "omission-pc-conflicts-rejected-stage01",
      "bounded-30-template-catalog-stage01",
      "modifier-powersets-rejected-stage01",
      "individual-alterations-60-stage01",
      "root-evidence-indexed-max-180-visits-stage01",
      "representability-status-reasons-stage01",
      "target-slash-24-stage01",
      "canonical-explicit-no-alt-stage01",
      "shadow-round-trip-exact-stage01",
      "existing-controls-exact-stage01",
      "ambiguity-fail-open-stage01",
      "deterministic-pure-bounded-stage01",
      "family-a-exact-regression-stage01",
      "family-b-exact-regression-stage01",
      "official-clean-suite-stage01",
      "typecheck-build-stage01",
      "changed-scope-eslint-stage01",
      "class-source-contract-lint-stage01",
      "repository-eslint-baseline-unchanged-stage01",
      "validate-phase-docs-stage01",
      "validate-ai-handoff-stage01",
      "git-diff-check-clean-stage01",
      "privacy-clean-stage01"
    ],
    "P5.39-02": [
      "production-diff-zero-stage02",
      "schema-fileversion-diff-zero-stage02",
      "stage01-grammar-frozen-stage02",
      "target-candidate-presence-24-stage02",
      "base-target-top1-24-stage02",
      "metamorphic-rank-invariance-216-stage02",
      "production-scorer-parity-252-stage02",
      "existing-controls-exact-264-stage02",
      "newly-verbose-labels-zero-stage02",
      "with-fifth-hard-negatives-24-stage02",
      "single-alteration-controls-60-stage02",
      "sparse-shell-guide-tone-safety-24-stage02",
      "power-fifth-ambiguity-safety-12-stage02",
      "partial-evidence-safety-stage02",
      "extra-tone-omission-conflict-stage02",
      "slash-bass-safety-24-stage02",
      "canonical-explicit-no-alt-stage02",
      "candidate-visits-276-max300-stage02",
      "deterministic-source-immutable-stage02",
      "family-a-exact-regression-stage02",
      "family-b-exact-regression-stage02",
      "focused-stage02-tests",
      "official-clean-suite-stage02",
      "typecheck-build-stage02",
      "changed-scope-eslint-stage02",
      "class-source-contract-lint-stage02",
      "repository-eslint-baseline-unchanged-stage02",
      "validate-phase-docs-stage02",
      "validate-ai-handoff-stage02",
      "git-diff-check-clean-stage02",
      "privacy-clean-stage02"
    ],
    "P5.39-03": [
      "promotion-gates-a-l-stage03",
      "private-known-targets-stage03",
      "private-whole-file-safety-stage03",
      "production-representation-proposal-stage03",
      "production-diff-zero-stage03",
      "schema-fileversion-diff-zero-stage03",
      "official-clean-suite-stage03",
      "typecheck-build-stage03",
      "changed-scope-eslint-stage03",
      "class-source-contract-lint-stage03",
      "repository-eslint-baseline-unchanged-stage03",
      "validate-phase-docs-stage03",
      "validate-ai-handoff-stage03",
      "git-diff-check-clean-stage03",
      "privacy-clean-stage03"
    ]
  },
  "gateResults": {
    "collision-check": "pass",
    "p538-closed-in-ancestry": "pass",
    "p537-closed-in-ancestry": "pass",
    "vocabulary-seams-audited": "pass",
    "generated-baselines-frozen": "pass",
    "promotion-gates-frozen": "pass",
    "family-a-invariants-frozen": "pass",
    "family-b-invariants-frozen": "pass",
    "focused-stage00-tests": "pass",
    "official-clean-suite": "pass",
    "validate:phase-docs": "pass",
    "validate:ai-handoff": "pass",
    "production-diff-zero": "pass",
    "git-diff-check-clean": "pass",
    "privacy-clean": "pass",
    "production-diff-zero-stage01": "pass",
    "schema-fileversion-diff-zero-stage01": "pass",
    "target-a-12-roots-stage01": "pass",
    "target-b-12-roots-stage01": "pass",
    "metamorphic-four-per-root-stage01": "pass",
    "order-register-octave-doubling-invariant-stage01": "pass",
    "bass-separate-stage01": "pass",
    "omissions-explicit-stage01": "pass",
    "omission-pc-conflicts-rejected-stage01": "pass",
    "bounded-30-template-catalog-stage01": "pass",
    "modifier-powersets-rejected-stage01": "pass",
    "individual-alterations-60-stage01": "pass",
    "root-evidence-indexed-max-180-visits-stage01": "pass",
    "representability-status-reasons-stage01": "pass",
    "target-slash-24-stage01": "pass",
    "canonical-explicit-no-alt-stage01": "pass",
    "shadow-round-trip-exact-stage01": "pass",
    "existing-controls-exact-stage01": "pass",
    "ambiguity-fail-open-stage01": "pass",
    "deterministic-pure-bounded-stage01": "pass",
    "family-a-exact-regression-stage01": "pass",
    "family-b-exact-regression-stage01": "pass",
    "typecheck-build-stage01": "pass",
    "changed-scope-eslint-stage01": "pass",
    "class-source-contract-lint-stage01": "pass",
    "official-clean-suite-stage01": "pass",
    "repository-eslint-baseline-unchanged-stage01": "pass",
    "validate-phase-docs-stage01": "pass",
    "validate-ai-handoff-stage01": "pass",
    "git-diff-check-clean-stage01": "pass",
    "privacy-clean-stage01": "pass",
    "production-diff-zero-stage02": "pass",
    "schema-fileversion-diff-zero-stage02": "pass",
    "stage01-grammar-frozen-stage02": "pass",
    "target-candidate-presence-24-stage02": "pass",
    "base-target-top1-24-stage02": "pass",
    "metamorphic-rank-invariance-216-stage02": "pass",
    "production-scorer-parity-252-stage02": "pass",
    "existing-controls-exact-264-stage02": "pass",
    "newly-verbose-labels-zero-stage02": "pass",
    "with-fifth-hard-negatives-24-stage02": "pass",
    "single-alteration-controls-60-stage02": "pass",
    "sparse-shell-guide-tone-safety-24-stage02": "pass",
    "power-fifth-ambiguity-safety-12-stage02": "pass",
    "partial-evidence-safety-stage02": "pass",
    "extra-tone-omission-conflict-stage02": "pass",
    "slash-bass-safety-24-stage02": "pass",
    "canonical-explicit-no-alt-stage02": "pass",
    "candidate-visits-276-max300-stage02": "pass",
    "deterministic-source-immutable-stage02": "pass",
    "family-a-exact-regression-stage02": "pass",
    "family-b-exact-regression-stage02": "pass",
    "focused-stage02-tests": "pass",
    "official-clean-suite-stage02": "pass",
    "typecheck-build-stage02": "pass",
    "changed-scope-eslint-stage02": "pass",
    "class-source-contract-lint-stage02": "pass",
    "repository-eslint-baseline-unchanged-stage02": "pass",
    "validate-phase-docs-stage02": "pass",
    "validate-ai-handoff-stage02": "pass",
    "git-diff-check-clean-stage02": "pass",
    "privacy-clean-stage02": "pass",
    "promotion-gates-a-l-stage03": "fail",
    "private-known-targets-stage03": "fail",
    "private-whole-file-safety-stage03": "fail",
    "production-representation-proposal-stage03": "skipped-not-authorized",
    "production-diff-zero-stage03": "pass",
    "schema-fileversion-diff-zero-stage03": "pass",
    "official-clean-suite-stage03": "pass",
    "typecheck-build-stage03": "pass",
    "changed-scope-eslint-stage03": "pass",
    "class-source-contract-lint-stage03": "pass",
    "repository-eslint-baseline-unchanged-stage03": "pass",
    "validate-phase-docs-stage03": "pass",
    "validate-ai-handoff-stage03": "pass",
    "git-diff-check-clean-stage03": "pass",
    "privacy-clean-stage03": "pass",
    "PROMOTION": "FAIL"
  },
  "nextAction": "Commit P5.39-03 PROMOTION = FAIL and STOP. P5.39-04 Production Integration is not authorized. Await explicit human authorization for any follow-up.",
  "updatedAt": "2026-09-23"
}
