{
  "schemaVersion": 1,
  "phaseId": "5.33",
  "status": "in-progress",
  "activeStage": "P5.33-00",
  "completedStages": [],
  "blocked": false,
  "blockerReason": null,
  "baseCommit": "c78a2a6ebe8d4172037a639cbdbf8f751cabac9c",
  "lastVerifiedCommit": "c78a2a6ebe8d4172037a639cbdbf8f751cabac9c",
  "currentBranch": "feat/p533-voicing-rule-engine-v2",
  "requiredGates": {
    "P5.33-00": [
      "intake-manifest",
      "baseline-tests",
      "inventory-matrices",
      "typescript-lint",
      "phase-docs",
      "production-unchanged",
      "security-privacy",
      "diff-check",
      "clean-status"
    ]
  },
  "gateResults": {
    "intake-manifest": "pass"
  },
  "nextAction": "Finish P5.33-00 verification and stop. Do not begin runtime rule implementation or P5.33-01 without separate human authorization.",
  "updatedAt": "2026-09-16T13:20:00+09:00"
}
