{
  "schemaVersion": 1,
  "phaseId": "10.0",
  "status": "in-progress",
  "activeStage": "P10.0-07",
  "completedStages": [
    "P10.0-00",
    "P10.0-02",
    "P10.0-03",
    "P10.0-04",
    "P10.0-05",
    "P10.0-06"
  ],
  "blocked": false,
  "blockerReason": null,
  "baseCommit": "327b2c1",
  "lastVerifiedCommit": "bbd843c",
  "currentBranch": "feat/p10.0-07-finish",
  "requiredGates": {
    "P10.0-00": [
      "p10-00-phase-docs",
      "p10-00-audit-inventory",
      "p10-00-audit-voicing",
      "p10-00-audit-correction-model",
      "p10-00-baseline",
      "p10-00-screens-before",
      "p10-00-data-retention",
      "p10-00-full-fresh",
      "p10-00-report"
    ],
    "P10.0-01": [
      "p10-01-full-fresh",
      "p10-01-exe",
      "p10-01-report"
    ],
    "P10.0-02": [
      "p10-02-phase-docs",
      "p10-02-hooks",
      "p10-02-model-unit",
      "p10-02-ui-gate",
      "p10-02-e2e-display",
      "p10-02-data-retention",
      "p10-02-screens",
      "p10-02-full-fresh",
      "p10-02-exe",
      "p10-02-report"
    ],
    "P10.0-03": [
      "p10-03-phase-docs",
      "p10-03-unit",
      "p10-03-fast-feature",
      "p10-03-ui",
      "p10-03-e2e",
      "p10-03-checkpoint"
    ],
    "P10.0-04": [
      "p10-04-unit",
      "p10-04-fast-feature",
      "p10-04-ui",
      "p10-04-e2e",
      "p10-04-checkpoint"
    ],
    "P10.0-05": [
      "p10-05-unit",
      "p10-05-ui",
      "p10-05-e2e",
      "p10-05-perf",
      "p10-05-data-retention",
      "p10-05-screens",
      "p10-05-full-fresh",
      "p10-05-exe",
      "p10-05-report"
    ],
    "P10.0-06": [
      "p10-06-phase-docs",
      "p10-06-save-unit",
      "p10-06-data-retention",
      "p10-06-playback-match",
      "p10-06-fast-feature",
      "p10-06-ui",
      "p10-06-e2e",
      "p10-06-screens",
      "p10-06-full-fresh",
      "p10-06-exe",
      "p10-06-report"
    ],
    "P10.0-07": [
      "p10-07-phase-docs",
      "p10-07-fixes",
      "p10-07-metrics",
      "p10-07-removal",
      "p10-07-fast-feature",
      "p10-07-ui",
      "p10-07-data-retention",
      "p10-07-screens",
      "p10-07-full-fresh",
      "p10-07-exe",
      "p10-07-report"
    ]
  },
  "gateResults": {
    "p10-00-phase-docs": "pass",
    "p10-00-audit-inventory": "pass",
    "p10-00-audit-voicing": "pass",
    "p10-00-audit-correction-model": "pass",
    "p10-00-baseline": "pass",
    "p10-00-screens-before": "pass",
    "p10-00-data-retention": "pass",
    "p10-00-full-fresh": "pass",
    "p10-00-report": "pass",
    "p10-02-phase-docs": "pass",
    "p10-02-hooks": "pass",
    "p10-02-model-unit": "pass",
    "p10-02-ui-gate": "pass",
    "p10-02-e2e-display": "pass",
    "p10-02-data-retention": "pass",
    "p10-02-screens": "pass",
    "p10-02-full-fresh": "pass",
    "p10-02-exe": "pass",
    "p10-02-report": "pass",
    "p10-03-phase-docs": "pass",
    "p10-03-unit": "pass",
    "p10-03-fast-feature": "pass",
    "p10-03-ui": "pass",
    "p10-03-e2e": "pass",
    "p10-03-checkpoint": "pass",
    "p10-04-unit": "pass",
    "p10-04-fast-feature": "pass",
    "p10-04-ui": "pass",
    "p10-04-e2e": "pass",
    "p10-04-checkpoint": "pass",
    "p10-05-unit": "pass",
    "p10-05-ui": "pass",
    "p10-05-e2e": "pass",
    "p10-05-perf": "pass",
    "p10-05-data-retention": "pass",
    "p10-05-screens": "pass",
    "p10-05-full-fresh": "pass",
    "p10-05-exe": "pass",
    "p10-05-report": "pass",
    "p10-06-phase-docs": "pass",
    "p10-06-save-unit": "pass",
    "p10-06-data-retention": "pass",
    "p10-06-playback-match": "pass",
    "p10-06-fast-feature": "pass",
    "p10-06-ui": "pass",
    "p10-06-e2e": "pass",
    "p10-06-screens": "pass",
    "p10-06-full-fresh": "pass",
    "p10-06-exe": "pass",
    "p10-06-report": "pass",
    "p10-07-phase-docs": "pass"
  },
  "nextAction": "P10.0-07: run stages/P10.0-07.md (EXE fixes, metrics, legacy removal, finish) on feat/p10.0-07-finish, then stop at the merge candidate.",
  "updatedAt": "2026-10-01"
}
