{
  "schemaVersion": 1,
  "phaseId": "8.9",
  "status": "in-progress",
  "activeStage": "P8.9-04",
  "completedStages": [
    "P8.9-00",
    "P8.9-01",
    "P8.9-02",
    "P8.9-03"
  ],
  "blocked": false,
  "blockerReason": null,
  "baseCommit": "e2cbd35",
  "lastVerifiedCommit": "d23f25a",
  "currentBranch": "feat/p8.9-04-home-vault",
  "requiredGates": {
    "P8.9-00": [
      "p89-00-phase-docs",
      "p89-00-data-retention",
      "p89-00-screens-baseline",
      "p89-00-audit",
      "p89-00-full-fresh",
      "p89-00-report"
    ],
    "P8.9-01": [
      "p89-01-full-fresh",
      "p89-01-screens",
      "p89-01-exe",
      "p89-01-report"
    ],
    "P8.9-02": [
      "p89-02-full-fresh",
      "p89-02-screens",
      "p89-02-exe",
      "p89-02-report"
    ],
    "P8.9-03": [
      "p89-03-full-fresh",
      "p89-03-screens",
      "p89-03-exe",
      "p89-03-report"
    ],
    "P8.9-04": [
      "p89-04-full-fresh",
      "p89-04-screens",
      "p89-04-exe",
      "p89-04-report"
    ],
    "P8.9-05": [
      "p89-05-full-fresh",
      "p89-05-screens",
      "p89-05-exe",
      "p89-05-report"
    ],
    "P8.9-08": [
      "p89-08-full-fresh",
      "p89-08-screens",
      "p89-08-exe",
      "p89-08-report"
    ]
  },
  "gateResults": {
    "p89-00-phase-docs": "pass",
    "p89-00-data-retention": "pass",
    "p89-00-screens-baseline": "pass",
    "p89-00-audit": "pass",
    "p89-00-full-fresh": "pass",
    "p89-00-report": "pass",
    "p89-01-full-fresh": "pass",
    "p89-01-screens": "pass",
    "p89-01-exe": "pass",
    "p89-01-report": "pass",
    "p89-02-full-fresh": "pass",
    "p89-02-screens": "pass",
    "p89-02-exe": "pass",
    "p89-02-report": "pass",
    "p89-03-full-fresh": "pass",
    "p89-03-screens": "pass",
    "p89-03-exe": "pass",
    "p89-03-report": "pass"
  },
  "nextAction": "P8.9-04 in progress on feat/p8.9-04-home-vault (base local master e2cbd35, stage 3 merged). Steps 0-6 of stages/P8.9-04.md: split Home/Vault logic, rebuild Home (mock RHome) and Vault (progressions only), remove the capture next-action input, baselines/screens, fresh FULL, EXE, report. Stop at the merge candidate; no push/tag/release.",
  "updatedAt": "2026-09-28"
}
