{
  "schemaVersion": 1,
  "phaseId": "5.24",
  "status": "in-progress",
  "activeStage": "P5.24-01",
  "completedStages": ["P5.24-00"],
  "blocked": false,
  "blockerReason": null,
  "baseCommit": "197e2de62b57139ed810fa0a2d28d208fd252800",
  "lastVerifiedCommit": "a91e8da5b52999198bb299cb3012a1b78197ba87",
  "currentBranch": "feat/p524-harmonic-rhythm-fragment-consolidation",
  "requiredGates": {
    "P5.24-00": [
      "p524-00-phase-docs-validation",
      "p524-00-synthetic-contract",
      "p524-00-official-baseline",
      "p524-00-focused-analyzer",
      "p524-00-lint-typecheck",
      "p524-00-security-privacy-diff-hygiene"
    ],
    "P5.24-01": [
      "p524-01-harmonic-rhythm-bass-lane-focused",
      "p524-01-mixed-rhythm-fallback",
      "p524-01-shadow-production-equivalence",
      "p524-01-performance-safety"
    ],
    "P5.24-02": [
      "p524-02-a-k-shadow-metrics",
      "p524-02-promotion-decision",
      "p524-02-focused-regression",
      "p524-02-performance-safety"
    ],
    "P5.24-03": [
      "p524-03-off-deep-equality",
      "p524-03-on-focused-behavior",
      "p524-03-official-corpus-regression",
      "p524-03-protected-surface-hygiene"
    ],
    "P5.24-04": [
      "p524-04-full-vitest",
      "p524-04-full-playwright",
      "p524-04-tauri-release-build",
      "p524-04-artifact-integrity",
      "p524-04-final-security-audit-hygiene",
      "p524-04-human-acceptance"
    ]
  },
  "gateResults": {
    "p524-00-phase-docs-validation": "pass",
    "p524-00-synthetic-contract": "pass",
    "p524-00-official-baseline": "pass",
    "p524-00-focused-analyzer": "pass",
    "p524-00-lint-typecheck": "pass",
    "p524-00-security-privacy-diff-hygiene": "pass",
    "p524-01-harmonic-rhythm-bass-lane-focused": "not-run",
    "p524-01-mixed-rhythm-fallback": "not-run",
    "p524-01-shadow-production-equivalence": "not-run",
    "p524-01-performance-safety": "not-run",
    "p524-02-a-k-shadow-metrics": "not-run",
    "p524-02-promotion-decision": "not-run",
    "p524-02-focused-regression": "not-run",
    "p524-02-performance-safety": "not-run",
    "p524-03-off-deep-equality": "not-run",
    "p524-03-on-focused-behavior": "not-run",
    "p524-03-official-corpus-regression": "not-run",
    "p524-03-protected-surface-hygiene": "not-run",
    "p524-04-full-vitest": "not-run",
    "p524-04-full-playwright": "not-run",
    "p524-04-tauri-release-build": "not-run",
    "p524-04-artifact-integrity": "not-run",
    "p524-04-final-security-audit-hygiene": "not-run",
    "p524-04-human-acceptance": "not-run"
  },
  "nextAction": "Begin P5.24-01 Harmonic Rhythm + Bass Lane shadow implementation under Tier 1/2 and the phase-specific safety gates. Tier 3 gates remain reserved for P5.24-04. Do not merge, push, tag, release, or start P5.25.",
  "updatedAt": "2026-08-25T18:46:00+09:00"
}
