{
  "schemaVersion": 1,
  "phaseId": "10.1",
  "status": "in-progress",
  "activeStage": "P10.1-01",
  "completedStages": [],
  "blocked": false,
  "blockerReason": null,
  "baseCommit": "1f18e880",
  "lastVerifiedCommit": "74388f0e",
  "currentBranch": "feat/p10.1-workspace-fixes",
  "requiredGates": {
    "P10.1-01": [
      "p10.1-01-phase-docs",
      "p10.1-01-layout-playback",
      "p10.1-01-keys-selection",
      "p10.1-01-name-tempo",
      "p10.1-01-fast-feature",
      "p10.1-01-ui",
      "p10.1-01-data-retention",
      "p10.1-01-screens",
      "p10.1-01-full-fresh",
      "p10.1-01-exe",
      "p10.1-01-report"
    ]
  },
  "gateResults": {
    "p10.1-01-phase-docs": "pass",
    "p10.1-01-layout-playback": "pass",
    "p10.1-01-keys-selection": "pass",
    "p10.1-01-name-tempo": "pass"
  },
  "nextAction": "P10.1-01: 区切り1〜3 済み。区切り4（スクリーンショット・UI・データ保持・fresh FULL・EXE・報告）へ。",
  "updatedAt": "2026-10-02"
}
