{
  "schemaVersion": 1,
  "phaseId": "8.8.5",
  "status": "in-progress",
  "activeStage": "P8.8.5-02",
  "completedStages": [
    "P8.8.5-00",
    "P8.8.5-01"
  ],
  "blocked": false,
  "blockerReason": null,
  "baseCommit": "340e45455cd8f7a91648db5ee2f92fe42c794d7c",
  "lastVerifiedCommit": "a5af6d936c8a97075c79027e941e13d91baf5824",
  "currentBranch": "feat/phase8.8.5-global-playback-text-polish",
  "requiredGates": {
    "P8.8.5-00": [
      "baseline-audit",
      "phase-docs"
    ],
    "P8.8.5-01": [
      "capture-tabs"
    ],
    "P8.8.5-02": [
      "global-playback"
    ],
    "P8.8.5-03": [
      "transport-visuals"
    ],
    "P8.8.5-04": [
      "text-workspace"
    ],
    "P8.8.5-05": [
      "preview-save-accessibility"
    ],
    "P8.8.5-06": [
      "responsive-regression"
    ],
    "P8.8.5-07": [
      "full-gates"
    ]
  },
  "gateResults": {
    "baseline-audit": "pass",
    "phase-docs": "pass",
    "capture-tabs": "pass"
  },
  "nextAction": "Unify global audition timbre and metronome preference",
  "updatedAt": "2026-09-26"
}
