{
  "schemaVersion": 1,
  "phaseId": "5.20",
  "status": "in-progress",
  "activeStage": "P5.20-03",
  "completedStages": ["P5.20-00", "P5.20-01", "P5.20-02"],
  "blocked": false,
  "blockerReason": null,
  "baseCommit": "1cec3fa920daeb4fb4942dfbd4a273d5624a0bfb",
  "lastVerifiedCommit": "12e49206451a7265080f76d2e5b30b549d635548",
  "currentBranch": "feat/p520-text-progression-entry",
  "requiredGates": {
    "P5.20-00": [
      "p520-00-phase-docs-validation",
      "p520-00-validator-tests",
      "p520-00-focused-baseline",
      "p520-00-capture-vault-regression",
      "p520-00-bass-practice-regression",
      "p520-00-lint",
      "p520-00-app-typecheck",
      "p520-00-e2e-typecheck",
      "p520-00-rust",
      "p520-00-diff-check",
      "p520-00-protected-surface"
    ],
    "P5.20-01": [
      "p520-01-parser-unit",
      "p520-01-parser-property-fuzz",
      "p520-01-capability-evaluator",
      "p520-01-app-typecheck",
      "p520-01-lint",
      "p520-01-diff-check",
      "p520-01-protected-surface"
    ],
    "P5.20-02": [
      "p520-02-capture-ui",
      "p520-02-draft-bridge",
      "p520-02-voicing-inspector",
      "p520-02-accessibility",
      "p520-02-app-typecheck",
      "p520-02-e2e-typecheck",
      "p520-02-lint",
      "p520-02-diff-check",
      "p520-02-protected-surface"
    ],
    "P5.20-03": [
      "p520-03-phase-docs-validation",
      "p520-03-focused-regressions",
      "p520-03-full-vitest",
      "p520-03-rust",
      "p520-03-playwright",
      "p520-03-web-build",
      "p520-03-tauri-build",
      "p520-03-accessibility-responsive",
      "p520-03-test-output-hygiene",
      "p520-03-diff-and-protected-surface"
    ]
  },
  "gateResults": {
    "p520-00-phase-docs-validation": "pass",
    "p520-00-validator-tests": "pass",
    "p520-00-focused-baseline": "pass",
    "p520-00-capture-vault-regression": "pass",
    "p520-00-bass-practice-regression": "pass",
    "p520-00-lint": "pass",
    "p520-00-app-typecheck": "pass",
    "p520-00-e2e-typecheck": "pass",
    "p520-00-rust": "pass",
    "p520-00-diff-check": "pass",
    "p520-00-protected-surface": "pass",
    "p520-01-parser-unit": "pass",
    "p520-01-parser-property-fuzz": "pass",
    "p520-01-capability-evaluator": "pass",
    "p520-01-app-typecheck": "pass",
    "p520-01-lint": "pass",
    "p520-01-diff-check": "pass",
    "p520-01-protected-surface": "pass",
    "p520-02-capture-ui": "pass",
    "p520-02-draft-bridge": "pass",
    "p520-02-voicing-inspector": "pass",
    "p520-02-accessibility": "pass",
    "p520-02-app-typecheck": "pass",
    "p520-02-e2e-typecheck": "pass",
    "p520-02-lint": "pass",
    "p520-02-diff-check": "pass",
    "p520-02-protected-surface": "pass",
    "p520-03-phase-docs-validation": "pass",
    "p520-03-focused-regressions": "pass",
    "p520-03-full-vitest": "pass",
    "p520-03-rust": "pass",
    "p520-03-playwright": "pass",
    "p520-03-web-build": "pass",
    "p520-03-tauri-build": "pass",
    "p520-03-accessibility-responsive": "pass",
    "p520-03-test-output-hygiene": "pass",
    "p520-03-diff-and-protected-surface": "pass"
  },
  "nextAction": "P5.20-03 automated re-verification passes at 12e49206451a7265080f76d2e5b30b549d635548 after the MIDI voicing-capture latch and piano-monitor fix. Continue only with documented human product re-acceptance; do not merge, push, or start P5.21.",
  "updatedAt": "2026-08-10"
}