{
  "schemaVersion": 1,
  "phaseId": "5.18.1",
  "status": "blocked",
  "activeStage": "P5.18.1-00",
  "completedStages": [],
  "blocked": true,
  "blockerReason": "The required complete preset forms are 4, 8, or 12 bars, but the protected P5.18 Chord Context/Bassline section contract allows only complete 4/8-beat (1/2-bar) 4/4 phrases. Silent splitting is not authorized.",
  "baseCommit": "328462abfdacc3496eb4f13da799165bd09527ef",
  "lastVerifiedCommit": "328462abfdacc3496eb4f13da799165bd09527ef",
  "currentBranch": "feat/p5181-bassline-preset-vault-picker",
  "requiredGates": {
    "P5.18.1-00": [
      "p5181-00-phase-docs-validation",
      "p5181-00-validator-tests",
      "p5181-00-full-vitest",
      "p5181-00-lint",
      "p5181-00-app-typecheck",
      "p5181-00-e2e-typecheck",
      "p5181-00-rust",
      "p5181-00-bass-practice-p518-regression",
      "p5181-00-git-diff-check"
    ]
  },
  "gateResults": {
    "p5181-00-phase-docs-validation": "pass",
    "p5181-00-validator-tests": "pass",
    "p5181-00-full-vitest": "pass",
    "p5181-00-lint": "pass",
    "p5181-00-app-typecheck": "pass",
    "p5181-00-e2e-typecheck": "pass",
    "p5181-00-rust": "pass",
    "p5181-00-bass-practice-p518-regression": "pass",
    "p5181-00-git-diff-check": "pass"
  },
  "nextAction": "Await human choice: define explicit selectable 1/2-bar windows per preset without changing P5.18, or separately authorize a scoped extension of the protected P5.18 section contract. Do not start P5.18.1-01.",
  "updatedAt": "2026-08-09"
}