{
  "schemaVersion": 1,
  "phaseId": "5.30",
  "status": "in-progress",
  "activeStage": "P5.30-04",
  "completedStages": ["P5.30-00", "P5.30-01", "P5.30-02", "P5.30-03"],
  "blocked": false,
  "blockerReason": null,
  "baseCommit": "15b1ed8222105abb0b57c3e19c0ecdc912dc9476",
  "lastVerifiedCommit": "b85719afb456efd59f87fcd23ef439126df7b512",
  "currentBranch": "feat/p530-voicing-loop-polish",
  "requiredGates": {
    "P5.30-00": ["phase-docs-validation", "baseline-ancestry", "intake-manifest-integrity", "production-source-unchanged", "diff-check"],
    "P5.30-01": ["focused-text-capacity", "maximum-envelope-roundtrip", "text-related-regression", "typescript-lint", "diff-check"],
    "P5.30-02": ["focused-layout-playhead", "fixed-geometry-stress", "accessibility-responsive", "typescript-lint", "diff-check"],
    "P5.30-03": ["focused-audio-interactions", "audio-lifecycle-stress", "all-mode-regression", "focused-playwright", "typescript-lint", "diff-check"],
    "P5.30-04": ["related-vitest", "playwright-regression", "production-build", "phase-docs-validation", "privacy-hygiene", "generated-output-hygiene", "diff-check", "clean-status"]
  },
  "gateResults": {
    "phase-docs-validation": "pass",
    "baseline-ancestry": "pass",
    "intake-manifest-integrity": "pass",
    "production-source-unchanged": "pass",
    "diff-check": "pass",
    "focused-text-capacity": "pass",
    "maximum-envelope-roundtrip": "pass",
    "text-related-regression": "pass",
    "typescript-lint": "pass",
    "focused-layout-playhead": "pass",
    "fixed-geometry-stress": "pass",
    "accessibility-responsive": "pass",
    "focused-audio-interactions": "pass",
    "audio-lifecycle-stress": "pass",
    "all-mode-regression": "pass",
    "focused-playwright": "pass"
  },
  "nextAction": "Run P5.30-04 hardening and product-acceptance gates.",
  "updatedAt": "2026-09-13T18:20:00+09:00"
}
