{
  "schemaVersion": 1,
  "phaseId": "5.32",
  "status": "completed",
  "activeStage": null,
  "completedStages": ["P5.32-00", "P5.32-01", "P5.32-02", "P5.32-03", "P5.32-04"],
  "blocked": false,
  "blockerReason": null,
  "baseCommit": "70b30d456456060045e908b05bbe7bde7bb51cd3",
  "lastVerifiedCommit": "9f3b057967579135646a66e0c7b7b3a0a6d946c8",
  "currentBranch": "fix/p532-human-acceptance-follow-up",
  "requiredGates": {
    "P5.32-00": ["baseline-tests", "typescript-lint", "phase-docs", "production-unchanged", "diff-check"],
    "P5.32-01": ["candidate-domain", "guide-priors", "candidate-bounds", "01-typescript-lint-diff"],
    "P5.32-02": ["cyclic-ranking", "guide-fixtures", "128-event-stress", "02-typescript-lint-diff"],
    "P5.32-03": ["six-mode-ui", "personal-persistence", "focused-playwright", "p530-p531-regression"],
    "P5.32-04": ["full-vitest", "full-playwright", "accessibility-responsive", "typescript-e2e-lint-build", "security-audit", "generated-private-cargo-hygiene", "phase-docs-diff-clean"]
  },
  "gateResults": {
    "baseline-tests": "pass",
    "typescript-lint": "pass",
    "phase-docs": "pass",
    "production-unchanged": "pass",
    "diff-check": "pass",
    "candidate-domain": "pass",
    "guide-priors": "pass",
    "candidate-bounds": "pass",
    "01-typescript-lint-diff": "pass",
    "cyclic-ranking": "pass",
    "guide-fixtures": "pass",
    "128-event-stress": "pass",
    "02-typescript-lint-diff": "pass",
    "six-mode-ui": "pass",
    "personal-persistence": "pass",
    "focused-playwright": "pass",
    "p530-p531-regression": "pass",
    "full-vitest": "pass",
    "full-playwright": "pass",
    "accessibility-responsive": "pass",
    "typescript-e2e-lint-build": "pass",
    "security-audit": "pass",
    "generated-private-cargo-hygiene": "pass",
    "phase-docs-diff-clean": "pass"
  },
  "nextAction": "READY FOR RENEWED PRODUCT ACCEPTANCE at 9f3b057967579135646a66e0c7b7b3a0a6d946c8: 2979 full Vitest tests and 73 fresh-production Playwright tests PASS. Human two-hand readability, hand comfort and desktop preference-reload acceptance pending. No merge/push/tag/release/P5.33.",
  "updatedAt": "2026-09-15T00:00:00+09:00"
}
