{
  "schemaVersion": 1,
  "phaseId": "5.18.2",
  "status": "in-progress",
  "activeStage": "P5.18.2-03",
  "completedStages": [
    "P5.18.2-00",
    "P5.18.2-01",
    "P5.18.2-02"
  ],
  "blocked": false,
  "blockerReason": null,
  "baseCommit": "81a689088436015f16596fa757998926b017718a",
  "lastVerifiedCommit": "b74ed52ff85ebf4fd5cc4aa9a55e432d79d69c78",
  "currentBranch": "feat/p5182-vault-source-discoverability",
  "requiredGates": {
    "P5.18.2-00": [
      "p5182-00-phase-docs-validation",
      "p5182-00-validator-tests",
      "p5182-00-focused-baseline-tests",
      "p5182-00-p5181-bass-practice-regression",
      "p5182-00-lint",
      "p5182-00-app-typecheck",
      "p5182-00-e2e-typecheck",
      "p5182-00-git-diff-check"
    ],
    "P5.18.2-01": [
      "p5182-01-title-viewmodel-search-tests",
      "p5182-01-privacy-boundary-regression",
      "p5182-01-bass-practice-regression",
      "p5182-01-lint",
      "p5182-01-app-typecheck",
      "p5182-01-e2e-typecheck",
      "p5182-01-phase-docs-validation",
      "p5182-01-git-diff-check",
      "p5182-01-protected-privacy"
    ],
    "P5.18.2-02": [
      "p5182-02-picker-ui-tests",
      "p5182-02-progression-detail-regression",
      "p5182-02-keyboard-a11y-viewport",
      "p5182-02-bass-practice-regression",
      "p5182-02-web-production-build",
      "p5182-02-lint",
      "p5182-02-app-typecheck",
      "p5182-02-e2e-typecheck",
      "p5182-02-phase-docs-validation",
      "p5182-02-git-diff-check",
      "p5182-02-protected-privacy"
    ]
  },
  "gateResults": {
    "p5182-00-phase-docs-validation": "pass",
    "p5182-00-validator-tests": "pass",
    "p5182-00-focused-baseline-tests": "pass",
    "p5182-00-p5181-bass-practice-regression": "pass",
    "p5182-00-lint": "pass",
    "p5182-00-app-typecheck": "pass",
    "p5182-00-e2e-typecheck": "pass",
    "p5182-00-git-diff-check": "pass",
    "p5182-01-title-viewmodel-search-tests": "pass",
    "p5182-01-privacy-boundary-regression": "pass",
    "p5182-01-bass-practice-regression": "pass",
    "p5182-01-lint": "pass",
    "p5182-01-app-typecheck": "pass",
    "p5182-01-e2e-typecheck": "pass",
    "p5182-01-phase-docs-validation": "pass",
    "p5182-01-git-diff-check": "pass",
    "p5182-01-protected-privacy": "pass",
    "p5182-02-picker-ui-tests": "pass",
    "p5182-02-progression-detail-regression": "pass",
    "p5182-02-keyboard-a11y-viewport": "pass",
    "p5182-02-bass-practice-regression": "pass",
    "p5182-02-web-production-build": "pass",
    "p5182-02-lint": "pass",
    "p5182-02-app-typecheck": "pass",
    "p5182-02-e2e-typecheck": "pass",
    "p5182-02-phase-docs-validation": "pass",
    "p5182-02-git-diff-check": "pass",
    "p5182-02-protected-privacy": "pass"
  },
  "nextAction": "P5.18.2-02 is complete. Await separate authorization before P5.18.2-03; do not merge, push, or start another phase.",
  "updatedAt": "2026-08-09"
}
